{
  "run_id": "run-kmd-polymer-001",
  "workspace_id": "ws-polymer-001",
  "domain_id": "polymer_science",
  "method_id": "kmd_analysis",
  "status": "succeeded",
  "started_at": "2026-04-04T09:00:00Z",
  "finished_at": "2026-04-04T09:00:02Z",
  "ssv_ref": "ssv-polymer-ps-001",
  "result": {
    "kmd_clusters": 5,
    "dominant_fragment": 104,
    "cluster_assignments": [
      { "label": "polystyrene_oligomer_1", "mass_range": [104, 208] },
      { "label": "polystyrene_oligomer_2", "mass_range": [208, 312] }
    ]
  },
  "execution_witness": {
    "compute_class": "classical",
    "backend_id": "polymer_science"
  }
}
